{
  "version": "1.0",

  "layers": [
    { "id": "biology",     "label": "Biology",            "order": 1, "units": ["kcal", "minutes", "g"] },
    { "id": "agriculture", "label": "Agriculture & Land", "order": 2, "units": ["ha", "t", "kg"] },
    { "id": "water",       "label": "Water",              "order": 3, "units": ["L", "gal", "km3/yr"] },
    { "id": "energy",      "label": "Energy",             "order": 4, "units": ["kWh", "TWh", "gCO2/kWh"] },
    { "id": "logistics",   "label": "Logistics",          "order": 5, "units": ["t-km", "hops", "cables"] },
    { "id": "compute",     "label": "Compute & Network",  "order": 6, "units": ["tokens", "Wh/query", "GPUs"] },
    { "id": "economics",   "label": "Economics",          "order": 7, "units": ["USD", "index", "%"] },
    { "id": "policy",      "label": "Policy",             "order": 8, "units": ["USD/yr", "gpm", "year"] }
  ],

  "nodes": [
    { "id": "you", "layer": "biology", "label": "You",
      "summary": "The person whose everyday action starts every trace." },
    { "id": "sandwich", "layer": "biology", "label": "A sandwich",
      "summary": "Two slices of bread (~90 g flour) plus filling. Roughly 450 kcal." },
    { "id": "claude-message", "layer": "compute", "label": "A Claude message",
      "summary": "One prompt and one reply: a few hundred tokens each way." },
    { "id": "hot-shower", "layer": "biology", "label": "A hot shower",
      "summary": "About eight minutes under a showerhead, most of it heated water." },

    { "id": "wheat-flour", "layer": "agriculture", "label": "Wheat flour",
      "summary": "Milled from wheat grain at ~75% extraction; bran and germ are removed." },
    { "id": "wheat", "layer": "agriculture", "label": "Wheat",
      "summary": "Grown on ~220 million hectares worldwide; supplies about a fifth of human calories." },
    { "id": "farmland", "layer": "agriculture", "label": "Farmland",
      "summary": "Cropland measured in hectare-years: how much ground, for how long, a harvest occupies." },
    { "id": "nitrogen-fertilizer", "layer": "agriculture", "label": "Nitrogen fertilizer",
      "summary": "Synthetic nitrogen (urea, ammonium nitrate) made from ammonia. Feeds roughly half of humanity." },

    { "id": "crop-water", "layer": "water", "label": "Crop water",
      "summary": "Rain (green water) and irrigation (blue water) taken up by a growing crop." },
    { "id": "household-water", "layer": "water", "label": "Household water",
      "summary": "Treated drinking water delivered to a home; showers are its second-largest indoor use." },
    { "id": "freshwater-withdrawals", "layer": "water", "label": "Freshwater withdrawals",
      "summary": "All water taken from rivers, lakes and aquifers worldwide, about 4,000 km³ a year." },
    { "id": "cooling-water", "layer": "water", "label": "Datacenter cooling water",
      "summary": "Water evaporated in cooling towers to carry heat away from servers." },

    { "id": "grid-generation", "layer": "energy", "label": "Grid electricity",
      "summary": "Power generated and delivered by the grid; its fuel mix sets the carbon cost of every kWh.",
      "metrics": [
        { "id": "grid-carbon-intensity-us", "label": "Carbon intensity of US electricity", "unit": "gCO2/kWh",
          "source": "owid-carbon-intensity", "cadence": "annual", "scope": "us",
          "fetch": { "kind": "owid-csv", "slug": "carbon-intensity-electricity", "entity": "USA", "column": "co2_intensity__gco2_kwh" } },
        { "id": "grid-carbon-intensity-world", "label": "Carbon intensity of world electricity", "unit": "gCO2/kWh",
          "source": "owid-carbon-intensity", "cadence": "annual", "scope": "global",
          "fetch": { "kind": "owid-csv", "slug": "carbon-intensity-electricity", "entity": "OWID_WRL", "column": "co2_intensity__gco2_kwh" } },
        { "id": "electricity-price-us", "label": "US residential electricity price", "unit": "USD/kWh",
          "source": "fred-apu000072610", "cadence": "monthly", "scope": "us",
          "fetch": { "kind": "fred-csv", "series": "APU000072610" } }
      ] },
    { "id": "ammonia-synthesis", "layer": "energy", "label": "Ammonia synthesis",
      "summary": "The Haber-Bosch process: natural gas and air become ammonia at high pressure. Fertilizer's energy bill." },
    { "id": "natural-gas", "layer": "energy", "label": "Natural gas",
      "summary": "Methane piped to power plants, factories and homes. Heats about half of US water heaters.",
      "metrics": [
        { "id": "henry-hub-price", "label": "Henry Hub natural gas spot price", "unit": "USD/MMBtu",
          "source": "fred-mhhngsp", "cadence": "monthly", "scope": "us",
          "fetch": { "kind": "fred-csv", "series": "MHHNGSP" } }
      ] },
    { "id": "diesel-fuel", "layer": "energy", "label": "Diesel",
      "summary": "The fuel of freight. Nearly every tonne-kilometre of road haulage burns it.",
      "metrics": [
        { "id": "diesel-price-us", "label": "US retail diesel price", "unit": "USD/gal",
          "source": "fred-gasdesw", "cadence": "weekly", "scope": "us",
          "fetch": { "kind": "fred-csv", "series": "GASDESW" } }
      ] },
    { "id": "water-heater", "layer": "energy", "label": "Water heater",
      "summary": "Gas or electric tank in the basement. Water heating is ~18% of a US home's energy use." },
    { "id": "datacenter-fleet", "layer": "energy", "label": "Datacenters",
      "summary": "The world's server halls, drawing roughly 1.5% of global electricity and rising fast." },

    { "id": "truck-freight", "layer": "logistics", "label": "Truck freight",
      "summary": "Road haulage: the last, most energy-intensive leg between mill, bakery and shelf." },
    { "id": "water-utility", "layer": "logistics", "label": "Water utility",
      "summary": "Treatment plants and mains that pump drinking water to the tap; a large, invisible electricity user." },
    { "id": "internet-backbone", "layer": "logistics", "label": "Internet backbone",
      "summary": "Long-haul fiber, exchange points and routers that carry packets between networks." },
    { "id": "submarine-cables", "layer": "logistics", "label": "Submarine cables",
      "summary": "About 600 fiber cables on the seabed carrying almost all intercontinental data." },

    { "id": "inference-cluster", "layer": "compute", "label": "Inference cluster",
      "summary": "Racks of accelerators that run the model when you press send." },
    { "id": "gpu", "layer": "compute", "label": "GPU accelerator",
      "summary": "The chip that does the matrix math. A single datacenter GPU costs tens of thousands of dollars." },

    { "id": "wheat-market", "layer": "economics", "label": "Wheat market",
      "summary": "Global benchmark price for wheat, set by the largest exporters.",
      "metrics": [
        { "id": "wheat-price-usd-t", "label": "Global price of wheat", "unit": "USD/t",
          "source": "fred-pwheamtusdm", "cadence": "monthly", "scope": "global",
          "fetch": { "kind": "fred-csv", "series": "PWHEAMTUSDM" } }
      ] },
    { "id": "food-cpi", "layer": "economics", "label": "Grocery prices",
      "summary": "What US households actually pay for food at home, tracked as an index.",
      "metrics": [
        { "id": "food-at-home-cpi", "label": "CPI: food at home (1982-84 = 100)", "unit": "index",
          "source": "fred-cusr0000saf11", "cadence": "monthly", "scope": "us",
          "fetch": { "kind": "fred-csv", "series": "CUSR0000SAF11" } }
      ] },
    { "id": "chip-foundry", "layer": "economics", "label": "Chip foundry",
      "summary": "The handful of fabs that can make leading-edge logic chips, concentrated in Taiwan." },
    { "id": "utility-bill", "layer": "economics", "label": "Utility bill",
      "summary": "Water, gas and electricity charges: the household's price for a shower." },

    { "id": "farm-policy", "layer": "policy", "label": "Farm policy",
      "summary": "Crop insurance, price supports and the Farm Bill: why grain costs what it costs." },
    { "id": "export-controls", "layer": "policy", "label": "Chip export controls",
      "summary": "US rules restricting which countries may buy advanced AI chips and the tools to make them." },
    { "id": "showerhead-standard", "layer": "policy", "label": "Showerhead standard",
      "summary": "The federal maximum flow rate for a showerhead, fixed in law since 1992." }
  ],

  "edges": [
    { "id": "you-eats-sandwich", "from": "you", "to": "sandwich",
      "quantity": 450, "unit": "kcal", "confidence": "medium", "scope": "global",
      "source": "usda-fooddata",
      "why": "Two slices of enriched white bread are ~160 kcal; a typical filling brings a whole sandwich to roughly 450 kcal." },
    { "id": "sandwich-uses-flour", "from": "sandwich", "to": "wheat-flour",
      "quantity": 90, "unit": "g flour", "confidence": "medium", "scope": "global",
      "source": "estimate-sandwich-flour",
      "why": "A 60 g slice of bread is about 45 g flour by weight after baking, so two slices is ~90 g. Estimate; varies by loaf." },
    { "id": "flour-from-wheat", "from": "wheat-flour", "to": "wheat",
      "quantity": 1.33, "unit": "kg wheat per kg flour", "confidence": "high", "scope": "global",
      "source": "fao-food-balance",
      "why": "Standard white flour extraction is ~75%: milling removes bran and germ, so 1 kg of flour needs ~1.33 kg of grain." },
    { "id": "wheat-needs-water", "from": "wheat", "to": "crop-water",
      "quantity": 1827, "range": [1500, 2200], "unit": "L per kg grain", "confidence": "medium", "scope": "global",
      "source": "wfn-mekonnen-hoekstra-2011",
      "why": "Global average water footprint of wheat, ~70% of it green water (rainfall) rather than irrigation. Regional values vary widely, hence the range." },
    { "id": "wheat-needs-land", "from": "wheat", "to": "farmland",
      "quantity": 3.6, "unit": "t grain per ha per year", "confidence": "high", "scope": "global",